{
  "schema_version": "1.2.0",
  "manifest_id": "pr01-search-v3",
  "protocol_id": "PR01",
  "status": "FROZEN",
  "frozen_at_utc": "2026-08-01T16:52:24Z",
  "frozen_by": "nguyen-ngoc-thien",
  "protocol_source": {
    "path": "protocols/PR01_literature_review.md",
      "sha256": "57C4FB842E80416EA27D6C999B2DC1A1AE223A75CB9D67D27531F800E2A4B133"
  },
  "coverage": {
    "publication_year_start": 2010,
    "publication_year_end": 2026,
    "search_cutoff_date": "2026-08-01",
    "languages": [
      "English"
    ],
    "document_types": [
      "journal-article",
      "conference-paper",
      "review"
    ],
    "older_classics_policy": "backward-snowballing-with-recorded-rationale",
    "rationale": "The window covers contemporary probabilistic MPC, human-motion prediction and mobile-robot NMPC; older foundational work is recovered by logged backward snowballing without altering database flow counts."
  },
  "screening": {
    "reviewer_ids": [
      "nguyen-ngoc-thien"
    ],
    "mode": "single-blinded-rescreen",
    "blinded_rescreen_fraction": 0.2,
    "sampling": "stratified-by-database-and-decision",
    "conflict_resolution": "All changed decisions are logged; unresolved scientific eligibility is escalated to the principal-investigator review before synthesis."
  },
  "filter_profiles": [
    {
      "filter_profile_id": "eligibility-2010-2026-en-peer-reviewed",
      "publication_year_start": 2010,
      "publication_year_end": 2026,
      "search_cutoff_date": "2026-08-01",
      "languages": [
        "English"
      ],
      "document_types": [
        "journal-article",
        "conference-paper",
        "review"
      ]
    }
  ],
  "databases": [
    {
      "database_id": "scopus",
      "database_name": "Scopus",
      "coverage_role": "core-bibliographic",
      "interface": "web-ui",
      "platform_url": "https://www.scopus.com/search/form.uri?display=advanced",
      "documentation_url": "https://service.elsevier.com/app/answers/detail/a_id/11365/supporthub/scopus/",
      "export_tool": {
        "name": "Scopus web export",
        "version": "accessed-2026-08-01"
      },
      "access_state_at_freeze": "access-blocked",
      "access_note": "Personal account is authenticated, but document search remains limited to Scopus Preview without student subscription access.",
      "required_for_completion": false,
      "retrieval_policy": {
        "mode": "all-results-pagination",
        "page_size": 1000,
        "ordering": "platform-default",
        "pagination_method": "ui-batch",
        "reported_total_semantics": "source-reported-unverified",
        "completion_rule": "terminal-pagination-state",
        "platform_record_limit": null,
        "overflow_action": "fail-and-amend",
        "scope_statement": "If institutional access becomes available, export every result exposed by the frozen Scopus query and facets."
      }
    },
    {
      "database_id": "web-of-science",
      "database_name": "Web of Science Core Collection",
      "coverage_role": "core-bibliographic",
      "interface": "web-ui",
      "platform_url": "https://www.webofscience.com/wos/woscc/advanced-search",
      "documentation_url": "https://webofscience.help.clarivate.com/Content/wos-core-collection/woscc-search-field-tags.htm",
      "export_tool": {
        "name": "Web of Science web export",
        "version": "accessed-2026-08-01"
      },
      "access_state_at_freeze": "access-blocked",
      "access_note": "Personal researcher-profile login succeeds, but Core Collection basic and advanced search routes are not entitled.",
      "required_for_completion": false,
      "retrieval_policy": {
        "mode": "all-results-pagination",
        "page_size": 1000,
        "ordering": "platform-default",
        "pagination_method": "ui-batch",
        "reported_total_semantics": "source-reported-unverified",
        "completion_rule": "terminal-pagination-state",
        "platform_record_limit": null,
        "overflow_action": "fail-and-amend",
        "scope_statement": "If institutional access becomes available, export every result exposed by the frozen Web of Science query and facets."
      }
    },
    {
      "database_id": "ieee-xplore",
      "database_name": "IEEE Xplore",
      "coverage_role": "core-bibliographic",
      "interface": "web-ui",
      "platform_url": "https://ieeexplore.ieee.org/search/advanced/command",
      "documentation_url": "https://ieeexplore.ieee.org/Xplorehelp/searching-ieee-xplore/search-examples",
      "export_tool": {
        "name": "IEEE Xplore web export",
        "version": "accessed-2026-08-01"
      },
      "access_state_at_freeze": "accessible",
      "access_note": "Public Command Search is accessible; publication-year and content-type facets are applied in the results UI.",
      "required_for_completion": true,
      "retrieval_policy": {
        "mode": "all-results-pagination",
        "page_size": 1000,
        "ordering": "platform-default",
        "pagination_method": "ui-batch",
        "reported_total_semantics": "source-reported-unverified",
        "completion_rule": "terminal-pagination-state",
        "platform_record_limit": null,
        "overflow_action": "fail-and-amend",
        "scope_statement": "Export every IEEE Xplore result exposed by the frozen command query and publication/content facets; fail and amend if the platform limit prevents this."
      }
    },
    {
      "database_id": "crossref",
      "database_name": "Crossref REST API",
      "coverage_role": "broad-robotics-control",
      "interface": "rest-api",
      "platform_url": "https://api.crossref.org/works",
      "documentation_url": "https://www.crossref.org/documentation/retrieve-metadata/rest-api/",
      "export_tool": {
        "name": "Crossref REST API relevance-ranked JSON export",
        "version": "v1-accessed-2026-08-01"
      },
      "access_state_at_freeze": "api-accessible",
      "access_note": "Public REST endpoint is accessible and used as a non-exhaustive, relevance-ranked recall supplement capped at 1000 records per query.",
      "required_for_completion": true,
      "retrieval_policy": {
        "mode": "ranked-cap",
        "cap_records_per_query": 1000,
        "page_size": 1000,
        "ordering": "score:desc",
        "pagination_method": "none",
        "reported_total_semantics": "source-reported-unverified",
        "completion_rule": "cap-reached-or-source-exhausted",
        "scope_statement": "Top 1000 relevance-ranked Crossref records per frozen query; this recall-supplement source is explicitly non-exhaustive."
      }
    },
    {
      "database_id": "semantic-scholar",
      "database_name": "Semantic Scholar Academic Graph API",
      "coverage_role": "broad-robotics-control",
      "interface": "rest-api",
      "platform_url": "https://api.semanticscholar.org/graph/v1/paper/search/bulk",
      "documentation_url": "https://www.semanticscholar.org/product/api/tutorial",
      "export_tool": {
        "name": "Semantic Scholar paper bulk search JSON export",
        "version": "graph-v1-accessed-2026-08-01"
      },
      "access_state_at_freeze": "api-accessible",
      "access_note": "The public bulk-search endpoint supports title/abstract Boolean matching, date and publication-type filters, and token pagination.",
      "required_for_completion": true,
      "retrieval_policy": {
        "mode": "all-results-pagination",
        "page_size": 1000,
        "ordering": "paperId:asc",
        "pagination_method": "continuation-token",
        "reported_total_semantics": "estimated",
        "completion_rule": "terminal-pagination-state",
        "platform_record_limit": 10000000,
        "overflow_action": "fail-and-amend",
        "scope_statement": "Retrieve every record exposed by Semantic Scholar token pagination; the reported total is descriptive and is not forced to equal the retrieved count."
      }
    }
  ],
  "queries": [
    {
      "query_id": "qry-scopus-context-human-nmpc",
      "database_id": "scopus",
      "concept_block": "context-human-nmpc",
      "lrq_ids": ["LRQ-01", "LRQ-05"],
      "search_fields": ["TITLE-ABS-KEY", "PUBYEAR"],
      "exact_query": "TITLE-ABS-KEY((\"nonlinear model predictive control\" OR NMPC OR \"model predictive control\") AND (\"context aware\" OR \"continuous context\" OR \"human aware\" OR social) AND (robot* OR mobile OR mecanum)) AND PUBYEAR > 2009 AND PUBYEAR < 2027",
      "filter_profile_id": "eligibility-2010-2026-en-peer-reviewed",
      "platform_filters": ["language:English", "document_type:Article", "document_type:Conference Paper", "document_type:Review"],
      "export_format": "ris"
    },
    {
      "query_id": "qry-scopus-chance-risk-human",
      "database_id": "scopus",
      "concept_block": "chance-risk-human",
      "lrq_ids": ["LRQ-02", "LRQ-05"],
      "search_fields": ["TITLE-ABS-KEY", "PUBYEAR"],
      "exact_query": "TITLE-ABS-KEY((chance-constrain* OR \"risk allocation\" OR probabilistic OR uncertainty) AND (NMPC OR \"model predictive control\") AND (human OR pedestrian OR trajectory)) AND PUBYEAR > 2009 AND PUBYEAR < 2027",
      "filter_profile_id": "eligibility-2010-2026-en-peer-reviewed",
      "platform_filters": ["language:English", "document_type:Article", "document_type:Conference Paper", "document_type:Review"],
      "export_format": "ris"
    },
    {
      "query_id": "qry-scopus-adaptive-risk",
      "database_id": "scopus",
      "concept_block": "adaptive-risk",
      "lrq_ids": ["LRQ-02", "LRQ-06"],
      "search_fields": ["TITLE-ABS-KEY", "PUBYEAR"],
      "exact_query": "TITLE-ABS-KEY((\"adaptive risk\" OR \"risk adaptation\" OR \"risk allocation\") AND (context* OR threat OR feasibility OR learned) AND (\"model predictive control\" OR NMPC OR CVaR OR \"barrier function\")) AND PUBYEAR > 2009 AND PUBYEAR < 2027",
      "filter_profile_id": "eligibility-2010-2026-en-peer-reviewed",